{
  "schema_version": "ticket-repair-payload/v1",
  "ticket_id": "RGR-P0A-02-C5B",
  "source_run_id": "p0a02-ai3-c5b",
  "finding_ids": ["F-1"],
  "target": {
    "file_path": ".claude/skills/ticket-rigor-gate/runner/fixtures-old/sibling_target.md",
    "write_mode": "addendum_only"
  },
  "findings": [
    {
      "finding_id": "F-1",
      "class": "fact-error",
      "severity": "Minor",
      "decisionness": "fact-layer",
      "summary": "Case 5b: target.file_path is a sibling directory (fixtures-old/) that shares a naive substring prefix with the canonical fixture root but is not actually nested under it; expect boundary comparison to correctly reject (override not reachable), original RTR-012 behavior, zero mutation.",
      "repair_eligibility": "eligible"
    }
  ],
  "evidence": [
    {
      "evidence_id": "E-1",
      "path": ".claude/skills/ticket-rigor-gate/runner/fixtures/p0a02/evidence/evidence_shared.md",
      "lines": "1-3",
      "excerpt": "FIXTURE_VALUE = 07",
      "claim": "FIXTURE_VALUE 之值為 07"
    }
  ],
  "constraints": {
    "max_changed_lines": 5
  },
  "quality_report": {
    "report_path": ".tmp/rigor-gate/fixture-latch/report_c5b.report.md"
  },
  "preauthorized_autonomous_apply": true,
  "required_verification": "fixture-ref-c5b"
}
