{
  "schema_version": "ticket-repair-payload/v1",
  "ticket_id": "RGR-P0A-02-C5",
  "source_run_id": "p0a02-ai3-c5",
  "finding_ids": ["F-1"],
  "target": {
    "file_path": ".tmp/p0a02_ai3_case5_outside_fixture_target.md",
    "write_mode": "addendum_only"
  },
  "findings": [
    {
      "finding_id": "F-1",
      "class": "fact-error",
      "severity": "Minor",
      "decisionness": "fact-layer",
      "summary": "Case 5: preauthorized_autonomous_apply=true with a valid required_verification, but target.file_path resolves outside the runner fixtures root; expect boundary to fail closed, original RTR-012 behavior, zero mutation.",
      "repair_eligibility": "eligible"
    }
  ],
  "evidence": [
    {
      "evidence_id": "E-1",
      "path": ".claude/skills/ticket-rigor-gate/runner/fixtures/p0a02/evidence/evidence_shared.md",
      "lines": "1-3",
      "excerpt": "FIXTURE_VALUE = 07",
      "claim": "FIXTURE_VALUE 之值為 07"
    }
  ],
  "constraints": {
    "max_changed_lines": 5
  },
  "quality_report": {
    "report_path": ".tmp/rigor-gate/fixture-latch/report_c5.report.md"
  },
  "preauthorized_autonomous_apply": true,
  "required_verification": "fixture-ref-c5"
}
