{
  "schema_version": "ticket-repair-payload/v1",
  "ticket_id": "RGR-P0A-02-C3",
  "source_run_id": "p0a02-ai3-c3",
  "finding_ids": ["F-1"],
  "target": {
    "file_path": ".claude/skills/ticket-rigor-gate/runner/fixtures/p0a02/targets/target_c3.md",
    "write_mode": "addendum_only"
  },
  "findings": [
    {
      "finding_id": "F-1",
      "class": "fact-error",
      "severity": "Minor",
      "decisionness": "fact-layer",
      "summary": "Case 3: preauthorized_autonomous_apply=true but required_verification missing; response self-reports requires_human_decision=true, expect override=false and original RTR-012 behavior.",
      "repair_eligibility": "eligible"
    }
  ],
  "evidence": [
    {
      "evidence_id": "E-1",
      "path": ".claude/skills/ticket-rigor-gate/runner/fixtures/p0a02/evidence/evidence_shared.md",
      "lines": "1-3",
      "excerpt": "FIXTURE_VALUE = 07",
      "claim": "FIXTURE_VALUE 之值為 07"
    }
  ],
  "constraints": {
    "max_changed_lines": 5
  },
  "quality_report": {
    "report_path": ".tmp/rigor-gate/fixture-latch/report_c3.report.md"
  },
  "preauthorized_autonomous_apply": true
}
