{
  "schema_version": "ticket-repair-payload/v1",
  "ticket_id": "RGR-P0A-01-FIXTURE",
  "source_run_id": "nocall-write-mode-forbidden",
  "finding_ids": ["F-WRITEMODE-1"],
  "target": {
    "file_path": ".claude/skills/ticket-rigor-gate/runner/fixtures/sandbox/target_placeholder.md",
    "write_mode": "full_rewrite"
  },
  "findings": [
    {
      "finding_id": "F-WRITEMODE-1",
      "class": "fact-error",
      "severity": "Minor",
      "decisionness": "fact-layer",
      "summary": "fixture: write_mode 非 addendum_only",
      "repair_eligibility": "eligible"
    }
  ],
  "evidence": [
    {
      "evidence_id": "E-1",
      "path": ".claude/skills/ticket-rigor-gate/runner/fixtures/sandbox/evidence_ok.md",
      "claim": "fixture placeholder"
    }
  ],
  "constraints": {
    "max_changed_lines": 10
  },
  "quality_report": {
    "report_path": ".tmp/rigor-gate/fixture-latch/write_mode_forbidden.report.md"
  }
}
