{
  "schema_version": "ticket-repair-payload/v1",
  "ticket_id": "RGR-P0A-01-FIXTURE-POSTFIX",
  "source_run_id": "truecall-postfix-01",
  "finding_ids": ["F-TRUECALL-1"],
  "target": {
    "file_path": ".claude/skills/ticket-rigor-gate/runner/fixtures/true_call/target_true_call.md",
    "write_mode": "addendum_only"
  },
  "findings": [
    {
      "finding_id": "F-TRUECALL-1",
      "class": "fact-error",
      "severity": "Minor",
      "decisionness": "fact-layer",
      "summary": "target 文件缺少 FIXTURE_CONSTANT 數值記錄，請依 evidence 補一行 addendum 記錄該數值",
      "repair_eligibility": "eligible"
    }
  ],
  "evidence": [
    {
      "evidence_id": "E-1",
      "path": ".claude/skills/ticket-rigor-gate/runner/fixtures/true_call/evidence_true_call.md",
      "lines": "1-3",
      "excerpt": "FIXTURE_CONSTANT = 42",
      "claim": "FIXTURE_CONSTANT 之值為 42"
    }
  ],
  "constraints": {
    "max_changed_lines": 5
  },
  "quality_report": {
    "report_path": ".tmp/rigor-gate/fixture-latch/report_true_call.report.md"
  }
}
