{
  "schema_version": "ticket-repair-payload/v1",
  "ticket_id": "RGR-P0A-01-FIXTURE",
  "source_run_id": "nocall-irreversible-target",
  "finding_ids": ["F-IRREV-1"],
  "target": {
    "file_path": "app/src/main/java/com/example/FixtureDummy.kt",
    "write_mode": "addendum_only"
  },
  "findings": [
    {
      "finding_id": "F-IRREV-1",
      "class": "fact-error",
      "severity": "Minor",
      "decisionness": "fact-layer",
      "summary": "fixture: target 落於不可逆路徑模式",
      "repair_eligibility": "eligible"
    }
  ],
  "evidence": [
    {
      "evidence_id": "E-1",
      "path": ".claude/skills/ticket-rigor-gate/runner/fixtures/sandbox/evidence_ok.md",
      "claim": "fixture placeholder"
    }
  ],
  "constraints": {
    "max_changed_lines": 10
  },
  "quality_report": {
    "report_path": ".tmp/rigor-gate/fixture-latch/irreversible_target.report.md"
  }
}
