{
  "schema_version": "ticket-repair-payload/v1",
  "ticket_id": "RGR-P0A-02-C2",
  "source_run_id": "p0a02-ai3-c2",
  "finding_ids": ["F-1"],
  "target": {
    "file_path": ".claude/skills/ticket-rigor-gate/runner/fixtures/p0a02/targets/target_c2.md",
    "write_mode": "addendum_only",
    "expected_old_text_hash": "sha256:0000000000000000000000000000000000000000000000000000000000000000"
  },
  "findings": [
    {
      "finding_id": "F-1",
      "class": "fact-error",
      "severity": "Minor",
      "decisionness": "fact-layer",
      "summary": "Case 2: preauthorized apply but payload declares a stale expected_old_text_hash, expect preimage guard to reject before decision-leakage is ever reached.",
      "repair_eligibility": "eligible"
    }
  ],
  "evidence": [
    {
      "evidence_id": "E-1",
      "path": ".claude/skills/ticket-rigor-gate/runner/fixtures/p0a02/evidence/evidence_shared.md",
      "lines": "1-3",
      "excerpt": "FIXTURE_VALUE = 07",
      "claim": "FIXTURE_VALUE 之值為 07"
    }
  ],
  "constraints": {
    "max_changed_lines": 5
  },
  "quality_report": {
    "report_path": ".claude/skills/ticket-rigor-gate/runner/fixtures/p0a02/reports/report_c2.report.md"
  },
  "preauthorized_autonomous_apply": true,
  "required_verification": "fixture-ref-c2"
}
