{
  "schema_version": "ticket-repair-payload/v1",
  "ticket_id": "RGR-P0A-02-C4",
  "source_run_id": "p0a02-ai3-c4",
  "finding_ids": ["F-1"],
  "target": {
    "file_path": ".claude/skills/ticket-rigor-gate/runner/fixtures/p0a02/targets/target_c4.md",
    "write_mode": "addendum_only"
  },
  "findings": [
    {
      "finding_id": "F-1",
      "class": "fact-error",
      "severity": "Minor",
      "decisionness": "fact-layer",
      "summary": "Case 4: legacy v1 payload shape with no preauthorization fields at all; expect behavior identical to pre-AI-2 runner (plain successful apply, no PREAUTHORIZED_/REQUIRED_VERIFICATION_REF/HUMAN_CHECKPOINT_EMITTED note).",
      "repair_eligibility": "eligible"
    }
  ],
  "evidence": [
    {
      "evidence_id": "E-1",
      "path": ".claude/skills/ticket-rigor-gate/runner/fixtures/p0a02/evidence/evidence_shared.md",
      "lines": "1-3",
      "excerpt": "FIXTURE_VALUE = 07",
      "claim": "FIXTURE_VALUE 之值為 07"
    }
  ],
  "constraints": {
    "max_changed_lines": 5
  },
  "quality_report": {
    "report_path": ".tmp/rigor-gate/fixture-latch/report_c4.report.md"
  }
}
