{
  "schema_version": "ticket-repair-payload/v1",
  "ticket_id": "RGR-P0A-02-C6",
  "source_run_id": "p0a02-ai3-c6",
  "finding_ids": ["F-1"],
  "target": {
    "file_path": ".claude/skills/ticket-rigor-gate/runner/fixtures/p0a02/targets/target_c6.md",
    "write_mode": "addendum_only"
  },
  "findings": [
    {
      "finding_id": "F-1",
      "class": "fact-error",
      "severity": "Minor",
      "decisionness": "fact-layer",
      "summary": "Case 6: preauthorization override succeeds at the self-report branch, but replacement_text still hits an existing FROZEN_LEAKAGE_MARKERS entry; expect the marker scan to reject unchanged, no applied receipt, and no preauthorization audit fields in the escalated report entry.",
      "repair_eligibility": "eligible"
    }
  ],
  "evidence": [
    {
      "evidence_id": "E-1",
      "path": ".claude/skills/ticket-rigor-gate/runner/fixtures/p0a02/evidence/evidence_shared.md",
      "lines": "1-3",
      "excerpt": "FIXTURE_VALUE = 07",
      "claim": "FIXTURE_VALUE 之值為 07"
    }
  ],
  "constraints": {
    "max_changed_lines": 5
  },
  "quality_report": {
    "report_path": ".claude/skills/ticket-rigor-gate/runner/fixtures/p0a02/reports/report_c6.report.md"
  },
  "preauthorized_autonomous_apply": true,
  "required_verification": "fixture-ref-c6"
}
